{
  "id": "spanakoryzo-tis-mamas",
  "name": "Σπανακόρυζο \"της Μαμάς\"",
  "name_en": "Mom's Spinach Rice",
  "description": "Κλασικό λαδερό σπανακόρυζο με δύο εκδόσεις — κατεψυγμένο ή φρέσκο σπανάκι. Σερβίρεται υποχρεωτικά με φέτα και τηγανητό αυγό.",
  "category": "λαδερά",
  "tags": ["σπανάκι", "ρύζι", "λαδερό", "μαμά", "χορτοφαγικό"],
  "source": {
    "origin": "Μαμά"
  },
  "servings": {
    "amount": 4,
    "label": "μερίδες"
  },
  "time": {
    "prep_minutes": 10,
    "cook_minutes": 30,
    "total_minutes": 40
  },
  "difficulty": "εύκολο",
  "equipment": [
    "πλατιά κατσαρόλα με καπάκι"
  ],
  "ingredients": [
    {
      "group": "Βάση",
      "name": "κατεψυγμένο σπανάκι",
      "amount": 1000,
      "unit": "γρ",
      "notes": "μπαίνει απευθείας παγωμένο",
      "optional": false,
      "substitutions": ["φρέσκο σπανάκι 500γρ (βλ. Έκδοση Β στις γενικές συμβουλές)"]
    },
    {
      "group": "Βάση",
      "name": "ρύζι",
      "amount": 1,
      "unit": "φλιτζάνι",
      "notes": "150-180γρ",
      "optional": false,
      "substitutions": []
    },
    {
      "group": "Αρωματικά",
      "name": "κρεμμύδι",
      "amount": 1,
      "unit": "τεμ",
      "notes": "ψιλοκομμένο",
      "optional": false,
      "substitutions": []
    },
    {
      "group": "Αρωματικά",
      "name": "φρέσκος άνηθος",
      "amount": 0.5,
      "unit": "ματσάκι",
      "notes": "μόνο φύλλα",
      "optional": false,
      "substitutions": []
    },
    {
      "group": "Σάλτσα",
      "name": "χυμός ντομάτας",
      "amount": 4,
      "unit": "κ.σ.",
      "notes": "3-4 κ.σ.",
      "optional": false,
      "substitutions": []
    },
    {
      "group": "Σάλτσα",
      "name": "νερό",
      "amount": 3,
      "unit": "φλιτζάνια",
      "optional": false,
      "substitutions": []
    },
    {
      "group": "Λάδι/Λίπος",
      "name": "ελαιόλαδο",
      "optional": false,
      "substitutions": []
    },
    {
      "group": "Καρυκεύματα",
      "name": "αλάτι",
      "optional": false,
      "substitutions": []
    },
    {
      "group": "Καρυκεύματα",
      "name": "πιπέρι",
      "optional": false,
      "substitutions": []
    }
  ],
  "steps": [
    {
      "order": 1,
      "title": "Σοτάρισμα κρεμμυδιού",
      "instruction": "Ζεσταίνεις ελαιόλαδο στην κατσαρόλα και σοτάρεις το ψιλοκομμένο κρεμμύδι μέχρι να μαλακώσει.",
      "heat_setting": {
        "level": "5-6",
        "label": "μέτρια"
      },
      "duration": {
        "minutes": 5,
        "until": "να μαλακώσει"
      },
      "tips": [],
      "ingredients_used": ["κρεμμύδι", "ελαιόλαδο"]
    },
    {
      "order": 2,
      "title": "Σπανάκι (κατεψυγμένο)",
      "instruction": "Ρίχνεις το σπανάκι ΑΠΕΥΘΕΙΑΣ παγωμένο στην κατσαρόλα, στην ίδια φωτιά. Ανακατεύεις μέχρι να λιώσει τελείως, 5-7 λεπτά.",
      "heat_setting": {
        "level": "5-6",
        "label": "μέτρια"
      },
      "duration": {
        "minutes": 6,
        "until": "να λιώσει τελείως το σπανάκι"
      },
      "tips": [
        "Έκδοση Β (φρέσκο σπανάκι 500γρ): μπαίνει στο 6-7 για 2-3 λεπτά ΜΟΝΟ — μαραίνεται πολύ γρήγορα, ανακατεύεις συνέχεια"
      ],
      "ingredients_used": ["κατεψυγμένο σπανάκι"]
    },
    {
      "order": 3,
      "title": "Ρύζι, ντομάτα και νερό",
      "instruction": "Προσθέτεις το ρύζι, τον χυμό ντομάτας και το νερό. Ανεβάζεις στο 6 για να ανακατέψεις καλά, μετά στο 7-8 μέχρι να πιάσει βράσιμο.",
      "heat_setting": {
        "level": "7-8",
        "label": "δυνατή"
      },
      "duration": {
        "until": "να πιάσει βράσιμο"
      },
      "tips": [],
      "ingredients_used": ["ρύζι", "χυμός ντομάτας", "νερό"]
    },
    {
      "order": 4,
      "title": "Σιγοβράσιμο",
      "instruction": "Μόλις βράσει, κατεβάζεις τη φωτιά στο 3-4 και βάζεις ΜΙΣΑΝΟΙΧΤΟ καπάκι. Σιγοβράζεις 15-18 λεπτά.",
      "heat_setting": {
        "level": "3-4",
        "label": "χαμηλή"
      },
      "duration": {
        "minutes": 17,
        "until": "το ρύζι να απορροφήσει το υγρό και να μαγειρευτεί"
      },
      "tips": [
        "Δοκίμασε το ρύζι στο 13-14ο λεπτό για να ελέγξεις πόσο ακόμα χρειάζεται",
        "ΜΙΣΑΝΟΙΧΤΟ καπάκι — όχι τελείως κλειστό, όχι τελείως ανοιχτό"
      ],
      "ingredients_used": []
    },
    {
      "order": 5,
      "title": "Άνηθος και φινίρισμα",
      "instruction": "Μόνο στο τέλος ρίχνεις τον φρέσκο άνηθο, ανακατεύεις, αλατοπιπερώνεις και κλείνεις τη φωτιά.",
      "heat_setting": {
        "level": "0",
        "label": "κλειστή"
      },
      "duration": {},
      "tips": [
        "Ο άνηθος μπαίνει ΜΟΝΟ στο τέλος για να κρατήσει το άρωμά του"
      ],
      "ingredients_used": ["φρέσκος άνηθος", "αλάτι", "πιπέρι"]
    }
  ],
  "serving_suggestion": "Φέτα + τηγανητό αυγό = υποχρεωτικά",
  "general_tips": [
    "Έκδοση Β (Φρέσκο σπανάκι 500γρ): Ίδιες αναλογίες μειωμένες στο μισό. Το φρέσκο σπανάκι μπαίνει στο 6-7 για 2-3 λεπτά ΜΟΝΟ — μαραίνεται πολύ γρήγορα, ανακατεύεις συνέχεια",
    "Αν βγει με πολύ υγρό → πιθανές αιτίες: λίγο παραπάνω νερό, ή φωτιά πολύ χαμηλά (3 αντί 3.5-4), ή καπάκι πολύ κλειστό. Την επόμενη φορά ρύθμισε ανάλογα"
  ],
  "modifications_log": [],
  "rating": {},
  "created_at": "2026-02-11T00:00:00.000Z",
  "updated_at": "2026-02-11T00:00:00.000Z"
}
