{
  "id": "fasolakia-ladera",
  "name": "Φασολάκια Λαδερά",
  "name_en": "Green Beans in Olive Oil",
  "description": "Κλασικό ελληνικό λαδερό με γενναιόδωρο ελαιόλαδο. Τρώγεται χλιαρό ή κρύο.",
  "category": "λαδερά",
  "tags": ["φασολάκια", "λαδερό", "χορτοφαγικό", "κλασικό", "νηστίσιμο"],
  "source": {
    "origin": "original"
  },
  "servings": {
    "amount": 4,
    "label": "μερίδες"
  },
  "time": {
    "prep_minutes": 10,
    "cook_minutes": 45,
    "total_minutes": 55
  },
  "difficulty": "εύκολο",
  "equipment": [
    "πλατιά κατσαρόλα"
  ],
  "ingredients": [
    {
      "group": "Βάση",
      "name": "φασολάκια",
      "amount": 1000,
      "unit": "γρ",
      "notes": "φρέσκα ή κατεψυγμένα — τα κατεψυγμένα μπαίνουν απευθείας παγωμένα",
      "optional": false,
      "substitutions": []
    },
    {
      "group": "Αρωματικά",
      "name": "κρεμμύδι",
      "amount": 1,
      "unit": "τεμ",
      "notes": "ψιλοκομμένο",
      "optional": false,
      "substitutions": []
    },
    {
      "group": "Αρωματικά",
      "name": "σκόρδο",
      "amount": 2,
      "unit": "σκελίδες",
      "optional": false,
      "substitutions": []
    },
    {
      "group": "Σάλτσα",
      "name": "ψιλοκομμένες ντομάτες",
      "amount": 225,
      "unit": "γρ",
      "notes": "200-250γρ, μισό κουτί",
      "optional": false,
      "substitutions": []
    },
    {
      "group": "Σάλτσα",
      "name": "νερό",
      "amount": 350,
      "unit": "ml",
      "notes": "300-400ml — πρέπει να καλύπτει τα φασολάκια",
      "optional": false,
      "substitutions": []
    },
    {
      "group": "Λάδι/Λίπος",
      "name": "ελαιόλαδο",
      "amount": 100,
      "unit": "ml",
      "notes": "λαδερό = γενναιόδωρο λάδι",
      "optional": false,
      "substitutions": []
    },
    {
      "group": "Καρυκεύματα",
      "name": "αλάτι",
      "optional": false,
      "substitutions": []
    },
    {
      "group": "Καρυκεύματα",
      "name": "πιπέρι",
      "optional": false,
      "substitutions": []
    },
    {
      "group": "Προαιρετικά",
      "name": "πατάτες",
      "notes": "σε κύβους — μπαίνουν μαζί με τα φασολάκια",
      "optional": true,
      "substitutions": []
    }
  ],
  "steps": [
    {
      "order": 1,
      "title": "Σοτάρισμα κρεμμυδιού και σκόρδου",
      "instruction": "Ζεσταίνεις το ελαιόλαδο στην κατσαρόλα και σοτάρεις κρεμμύδι και σκόρδο μέχρι να μαλακώσει το κρεμμύδι.",
      "heat_setting": {
        "level": "5",
        "label": "μέτρια"
      },
      "duration": {
        "minutes": 5,
        "until": "να μαλακώσει το κρεμμύδι"
      },
      "tips": [],
      "ingredients_used": ["ελαιόλαδο", "κρεμμύδι", "σκόρδο"]
    },
    {
      "order": 2,
      "title": "Φασολάκια, ντομάτα και βρασμός",
      "instruction": "Προσθέτεις τα φασολάκια, τις ψιλοκομμένες ντομάτες και το νερό. Αν βάλεις πατάτες, μπαίνουν τώρα μαζί. Ανεβάζεις τη φωτιά μέχρι να πιάσει βράσιμο.",
      "heat_setting": {
        "level": "7",
        "label": "δυνατή"
      },
      "duration": {
        "until": "να πιάσει βράσιμο"
      },
      "tips": [
        "Κατεψυγμένα φασολάκια: απευθείας παγωμένα, κανένα ξεπάγωμα",
        "Το νερό πρέπει να καλύπτει τα φασολάκια — αν δεν φτάνει, ρίχνεις λίγο παραπάνω",
        "Αν βάλεις πατάτες, μπαίνουν μαζί με τα φασολάκια"
      ],
      "ingredients_used": ["φασολάκια", "ψιλοκομμένες ντομάτες", "νερό", "αλάτι", "πιπέρι"]
    },
    {
      "order": 3,
      "title": "Σιγοβρασμός",
      "instruction": "Κατεβάζεις τη φωτιά, ΧΩΡΙΣ καπάκι, σιγοβράζεις 35-45 λεπτά μέχρι τα φασολάκια να μαλακώσουν και η σάλτσα να δέσει.",
      "heat_setting": {
        "level": "4",
        "label": "χαμηλή"
      },
      "duration": {
        "minutes": 40,
        "until": "τα φασολάκια να μαλακώσουν και η σάλτσα να δέσει"
      },
      "tips": [
        "Χωρίς καπάκι για να πυκνώσει η σάλτσα"
      ],
      "ingredients_used": []
    }
  ],
  "serving_suggestion": "Φέτα + ψωμί = κλασική ελληνική λαδερή τριάδα. Τρώγεται χλιαρό ή κρύο.",
  "general_tips": [
    "Κατεψυγμένα: απευθείας παγωμένα, κανένα ξεπάγωμα",
    "Το νερό πρέπει να καλύπτει τα φασολάκια — αν δεν φτάνει, ρίχνεις λίγο παραπάνω",
    "Αν βάλεις πατάτες, μπαίνουν μαζί με τα φασολάκια",
    "Λαδερό = γενναιόδωρο λάδι, μη φοβάσαι το ελαιόλαδο",
    "Τρώγεται χλιαρό ή κρύο — κλασικό λαδερό, δεν χρειάζεται να είναι καυτό"
  ],
  "modifications_log": [],
  "rating": {},
  "created_at": "2026-02-11T00:00:00.000Z",
  "updated_at": "2026-02-11T00:00:00.000Z"
}
