{
  "id": "fakes",
  "name": "Φακές",
  "name_en": "Lentil Soup",
  "description": "Κλασικές φακές με τη μέθοδο της μαμάς — όλα μαζί από την αρχή, ελαιόλαδο στο τέλος.",
  "category": "όσπρια",
  "tags": ["φακές", "όσπρια", "λαδερό", "μαμά", "νηστίσιμο", "χορτοφαγικό"],
  "source": {
    "origin": "Μαμά"
  },
  "servings": {
    "amount": 4,
    "label": "άτομα"
  },
  "time": {
    "prep_minutes": 5,
    "cook_minutes": 40,
    "total_minutes": 45
  },
  "difficulty": "εύκολο",
  "equipment": [
    "κατσαρόλα"
  ],
  "ingredients": [
    {
      "group": "Βάση",
      "name": "φακές",
      "amount": 400,
      "unit": "γρ",
      "optional": false,
      "substitutions": []
    },
    {
      "group": "Αρωματικά",
      "name": "σκόρδο",
      "amount": 2,
      "unit": "σκελίδες",
      "optional": false,
      "substitutions": []
    },
    {
      "group": "Αρωματικά",
      "name": "φύλλα δάφνη",
      "amount": 4,
      "unit": "τεμ",
      "optional": false,
      "substitutions": []
    },
    {
      "group": "Αρωματικά",
      "name": "κρεμμύδι",
      "amount": 1,
      "unit": "τεμ",
      "optional": false,
      "substitutions": []
    },
    {
      "group": "Σάλτσα",
      "name": "νερό",
      "amount": 1000,
      "unit": "ml",
      "notes": "4 ποτήρια",
      "optional": false,
      "substitutions": []
    },
    {
      "group": "Σάλτσα",
      "name": "ντοματοπολτός",
      "amount": 8,
      "unit": "κ.σ.",
      "notes": "6-8 κ.σ.",
      "optional": false,
      "substitutions": []
    },
    {
      "group": "Καρυκεύματα",
      "name": "αλάτι",
      "optional": false,
      "substitutions": []
    },
    {
      "group": "Καρυκεύματα",
      "name": "πιπέρι",
      "optional": false,
      "substitutions": []
    },
    {
      "group": "Λάδι/Λίπος",
      "name": "ελαιόλαδο",
      "amount": 10,
      "unit": "κ.σ.",
      "notes": "8-10 κ.σ. — ΣΤΟ ΤΕΛΟΣ, μετά το μαγείρεμα",
      "optional": false,
      "substitutions": []
    }
  ],
  "steps": [
    {
      "order": 1,
      "title": "Όλα μαζί στην κατσαρόλα",
      "instruction": "Ρίχνεις ΟΛΑ μαζί στην κατσαρόλα από την αρχή: φακές, νερό, ντοματοπολτό, σκόρδο, δάφνη, κρεμμύδι, αλάτι, πιπέρι. Ανεβάζεις στο 9 μέχρι να πιάσει βράσιμο.",
      "heat_setting": {
        "level": "9",
        "label": "MAX"
      },
      "duration": {
        "until": "να πιάσει βράσιμο"
      },
      "tips": [
        "ΟΧΙ σταδιακά τα υλικά — η μαμά ξέρει, όλα μέσα από την αρχή"
      ],
      "ingredients_used": ["φακές", "νερό", "ντοματοπολτός", "σκόρδο", "φύλλα δάφνη", "κρεμμύδι", "αλάτι", "πιπέρι"]
    },
    {
      "order": 2,
      "title": "Αφρός και ρύθμιση φωτιάς",
      "instruction": "Μόλις βράσει, βγάζεις τον αφρό από την επιφάνεια και κατεβάζεις τη φωτιά στο 7-8.",
      "heat_setting": {
        "level": "7-8",
        "label": "δυνατή"
      },
      "duration": {},
      "tips": [],
      "ingredients_used": []
    },
    {
      "order": 3,
      "title": "Σιγοβρασμός",
      "instruction": "Σιγοβράζεις ΧΩΡΙΣ καπάκι, 35-40 λεπτά. Ανακατεύεις κάθε 10 λεπτά.",
      "heat_setting": {
        "level": "7-8",
        "label": "δυνατή"
      },
      "duration": {
        "minutes": 38,
        "until": "οι φακές να μαλακώσουν και να δέσουν"
      },
      "tips": [
        "Χωρίς καπάκι για να δέσουν",
        "Ανακάτεμα κάθε 10 λεπτά γιατί κολλάνε στον πάτο"
      ],
      "ingredients_used": []
    },
    {
      "order": 4,
      "title": "Ελαιόλαδο στο τέλος",
      "instruction": "Κλείνεις τη φωτιά και ρίχνεις 8-10 κ.σ. ελαιόλαδο ΣΤΟ ΤΕΛΟΣ, μετά το μαγείρεμα. Ανακατεύεις.",
      "heat_setting": {
        "level": "0",
        "label": "κλειστή"
      },
      "duration": {},
      "tips": [
        "Γιατί λάδι στο τέλος; Διατηρεί γεύση, θρεπτικά, και είναι η παραδοσιακή λαδερή τεχνική. Αν μπει νωρίς, χάνει τα πάντα στο βράσιμο."
      ],
      "ingredients_used": ["ελαιόλαδο"]
    }
  ],
  "serving_suggestion": "Ξύδι + φέτα — μη classical combo",
  "general_tips": [
    "ΚΡΙΣΙΜΗ ΤΕΧΝΙΚΗ: ΟΛΑ ΜΑΖΙ από την αρχή — μέθοδος μαμάς, επιβεβαιωμένη σωστή",
    "Ελαιόλαδο ΣΤΟ ΤΕΛΟΣ: διατηρεί γεύση, θρεπτικά, και είναι η παραδοσιακή λαδερή τεχνική. Αν μπει νωρίς, χάνει τα πάντα στο βράσιμο",
    "Χωρίς καπάκι για να δέσουν",
    "Ανακάτεμα κάθε 10 λεπτά γιατί κολλάνε στον πάτο"
  ],
  "modifications_log": [],
  "rating": {},
  "created_at": "2026-02-11T00:00:00.000Z",
  "updated_at": "2026-02-11T00:00:00.000Z"
}
