{
  "id": "tiganito-avgo",
  "name": "Τηγανητό Αυγό",
  "name_en": "Fried Egg",
  "description": "Το μυστικό είναι η χαμηλή φωτιά — μάτι 4-5 και τίποτα παραπάνω. Τρεις εκδόσεις: sunny side up, over easy, over hard.",
  "category": "αυγά",
  "tags": ["αυγό", "τηγανητό", "τεχνική", "βασικό", "γρήγορο"],
  "source": {
    "origin": "original"
  },
  "servings": {
    "amount": 1,
    "label": "μερίδα"
  },
  "time": {
    "prep_minutes": 5,
    "cook_minutes": 3,
    "total_minutes": 8
  },
  "difficulty": "εύκολο",
  "equipment": [
    "μικρό τηγάνι αντικολλητικό"
  ],
  "ingredients": [
    {
      "group": "Βάση",
      "name": "αυγό",
      "amount": 1,
      "unit": "τεμ",
      "notes": "σε θερμοκρασία δωματίου 5 λεπτά πριν",
      "optional": false,
      "substitutions": []
    },
    {
      "group": "Λάδι/Λίπος",
      "name": "βούτυρο",
      "optional": false,
      "substitutions": ["ελαιόλαδο"]
    },
    {
      "group": "Καρυκεύματα",
      "name": "αλάτι",
      "notes": "ΠΑΝΤΑ στο τέλος",
      "optional": false,
      "substitutions": []
    },
    {
      "group": "Καρυκεύματα",
      "name": "πιπέρι",
      "notes": "ΠΑΝΤΑ στο τέλος",
      "optional": false,
      "substitutions": []
    }
  ],
  "steps": [
    {
      "order": 0,
      "title": "Προετοιμασία αυγού",
      "instruction": "Βγάζεις το αυγό από το ψυγείο 5 λεπτά πριν για να φτάσει σε θερμοκρασία δωματίου.",
      "duration": {
        "minutes": 5,
        "until": "να φτάσει σε θερμοκρασία δωματίου"
      },
      "tips": [],
      "ingredients_used": ["αυγό"]
    },
    {
      "order": 1,
      "title": "Ζέσταμα βουτύρου",
      "instruction": "Βάζεις βούτυρο στο τηγάνι σε χαμηλή-μέτρια φωτιά μέχρι να λιώσει.",
      "heat_setting": {
        "level": "4-5",
        "label": "μέτρια-χαμηλή"
      },
      "duration": {
        "until": "να λιώσει το βούτυρο"
      },
      "tips": [
        "Βούτυρο δίνει καλύτερο αποτέλεσμα αλλά ελαιόλαδο δουλεύει μια χαρά"
      ],
      "ingredients_used": ["βούτυρο"]
    },
    {
      "order": 2,
      "title": "Τηγάνισμα αυγού — πρώτη πλευρά",
      "instruction": "Σπας το αυγό απαλά στο τηγάνι. ΜΗΝ ανακατεύεις, αφήνεις ήσυχο. Ψήνεις 2-3 λεπτά ανάλογα με την έκδοση. Sunny side up: 2-3 λεπτά και τελείωσες. Over easy/hard: 2 λεπτά πρώτη πλευρά, μετά γύρισμα.",
      "heat_setting": {
        "level": "4-5",
        "label": "μέτρια-χαμηλή"
      },
      "duration": {
        "minutes": 2.5,
        "until": "το ασπράδι να πήξει χωρίς καμένες άκρες"
      },
      "tips": [
        "ΜΗΝ βιαστείς με τη φωτιά — ψηλή φωτιά = λαστιχένιο ασπράδι, καμένες άκρες, άψητος κρόκος",
        "Οι περισσότεροι το κάνουν λάθος γιατί βαράνε τη φωτιά στο 7-8"
      ],
      "ingredients_used": ["αυγό"]
    },
    {
      "order": 3,
      "title": "Γύρισμα (μόνο over easy / over hard)",
      "instruction": "Over easy (κρόκος ακόμα υγρός): γυρνάς και ψήνεις 30 δευτερόλεπτα - 1 λεπτό. Over hard (κρόκος ψημένος): γυρνάς και ψήνεις 1.5-2 λεπτά. Sunny side up: παράλειψε αυτό το βήμα.",
      "heat_setting": {
        "level": "4-5",
        "label": "μέτρια-χαμηλή"
      },
      "duration": {
        "minutes": 1,
        "until": "ανάλογα variant: over easy 30\"-1', over hard 1.5-2'"
      },
      "tips": [],
      "ingredients_used": []
    },
    {
      "order": 4,
      "title": "Φινίρισμα",
      "instruction": "Αλάτι και πιπέρι ΠΑΝΤΑ στο τέλος, ποτέ πριν.",
      "heat_setting": {
        "level": "0",
        "label": "κλειστή"
      },
      "duration": {},
      "tips": [
        "Αλάτι/πιπέρι ΠΑΝΤΑ στο τέλος — ποτέ πριν το τηγάνισμα"
      ],
      "ingredients_used": ["αλάτι", "πιπέρι"]
    }
  ],
  "general_tips": [
    "ΚΛΕΙΔΙ: Μάτι 4-5 και τίποτα παραπάνω — αυτό είναι όλο το μυστικό",
    "ΜΗΝ βιαστείς με τη φωτιά — ψηλή φωτιά = λαστιχένιο ασπράδι, καμένες άκρες, άψητος κρόκος",
    "Βούτυρο δίνει καλύτερο αποτέλεσμα αλλά ελαιόλαδο δουλεύει μια χαρά",
    "Αλάτι/πιπέρι ΠΑΝΤΑ στο τέλος, ποτέ πριν",
    "3 variants: Sunny side up (κρόκος υγρός, 2-3'), Over easy (γύρισμα + 30\"-1'), Over hard (γύρισμα + 1.5-2')"
  ],
  "modifications_log": [],
  "rating": {},
  "created_at": "2026-02-11T00:00:00.000Z",
  "updated_at": "2026-02-11T00:00:00.000Z"
}
