{
  "id": "omeleta-me-laxanika",
  "name": "Ομελέτα με Λαχανικά",
  "name_en": "Vegetable Omelette",
  "description": "Ομελέτα με καρότα, πιπεριές και κρεμμύδι. Αναλογία αυγών: 2 ολόκληρα + 1 ασπράδι για ελαφρύτερο αποτέλεσμα.",
  "category": "αυγά",
  "tags": ["αυγά", "ομελέτα", "λαχανικά", "γρήγορο", "ελαφρύ"],
  "source": {
    "origin": "original"
  },
  "servings": {
    "amount": 1,
    "label": "μερίδα"
  },
  "time": {
    "prep_minutes": 5,
    "cook_minutes": 15,
    "total_minutes": 20
  },
  "difficulty": "εύκολο",
  "equipment": [
    "τηγάνι αντικολλητικό"
  ],
  "ingredients": [
    {
      "group": "Βάση",
      "name": "αυγά (ολόκληρα)",
      "amount": 2,
      "unit": "τεμ",
      "optional": false,
      "substitutions": []
    },
    {
      "group": "Βάση",
      "name": "ασπράδι αυγού",
      "amount": 1,
      "unit": "τεμ",
      "optional": false,
      "substitutions": []
    },
    {
      "group": "Λαχανικά",
      "name": "καρότα",
      "optional": false,
      "substitutions": []
    },
    {
      "group": "Λαχανικά",
      "name": "πιπεριές",
      "optional": false,
      "substitutions": []
    },
    {
      "group": "Αρωματικά",
      "name": "κρεμμύδι",
      "optional": false,
      "substitutions": []
    },
    {
      "group": "Αρωματικά",
      "name": "σκόρδο",
      "optional": false,
      "substitutions": []
    },
    {
      "group": "Λάδι/Λίπος",
      "name": "ελαιόλαδο",
      "optional": false,
      "substitutions": []
    },
    {
      "group": "Καρυκεύματα",
      "name": "αλάτι",
      "optional": false,
      "substitutions": []
    },
    {
      "group": "Καρυκεύματα",
      "name": "πιπέρι",
      "optional": false,
      "substitutions": []
    },
    {
      "group": "Προαιρετικά",
      "name": "μυζήθρα ανάλατη",
      "amount": 60,
      "unit": "γρ",
      "notes": "50-70γρ — χτυπημένη μαζί με τα αυγά (πιο ομοιόμορφη) ή θρυμματισμένη πάνω στο τέλος (πιο rustic)",
      "optional": true,
      "substitutions": []
    },
    {
      "group": "Προαιρετικά",
      "name": "ρίγανη",
      "notes": "ελαφρά",
      "optional": true,
      "substitutions": []
    }
  ],
  "steps": [
    {
      "order": 1,
      "title": "Σοτάρισμα καρότων",
      "instruction": "Ζεσταίνεις ελαιόλαδο στο τηγάνι και σοτάρεις τα καρότα πρώτα γιατί θέλουν περισσότερο χρόνο, 5-7 λεπτά.",
      "heat_setting": {
        "level": "5-6",
        "label": "μέτρια"
      },
      "duration": {
        "minutes": 6,
        "until": "να μαλακώσουν τα καρότα"
      },
      "tips": [
        "Τα καρότα μπαίνουν πρώτα γιατί θέλουν περισσότερο χρόνο από τα υπόλοιπα λαχανικά"
      ],
      "ingredients_used": ["ελαιόλαδο", "καρότα"]
    },
    {
      "order": 2,
      "title": "Πιπεριές και κρεμμύδι",
      "instruction": "Προσθέτεις πιπεριές και κρεμμύδι στην ίδια φωτιά, σοτάρεις 3-4 λεπτά.",
      "heat_setting": {
        "level": "5-6",
        "label": "μέτρια"
      },
      "duration": {
        "minutes": 4,
        "until": "να μαλακώσουν"
      },
      "tips": [],
      "ingredients_used": ["πιπεριές", "κρεμμύδι"]
    },
    {
      "order": 3,
      "title": "Σκόρδο",
      "instruction": "Προσθέτεις το σκόρδο τελευταίο, 1 λεπτό μόνο.",
      "heat_setting": {
        "level": "5-6",
        "label": "μέτρια"
      },
      "duration": {
        "minutes": 1,
        "until": "να αρωματίσει"
      },
      "tips": [
        "Σκόρδο πάντα τελευταίο — καίγεται εύκολα"
      ],
      "ingredients_used": ["σκόρδο"]
    },
    {
      "order": 4,
      "title": "Αυγά — πρώτη πλευρά",
      "instruction": "Κατεβάζεις τη φωτιά στο 4-5. Ρίχνεις τα χτυπημένα αυγά (2 ολόκληρα + 1 ασπράδι) πάνω στα λαχανικά. Αφήνεις 3-4 λεπτά μέχρι να πήξει.",
      "heat_setting": {
        "level": "4-5",
        "label": "μέτρια-χαμηλή"
      },
      "duration": {
        "minutes": 4,
        "until": "να πήξει η πρώτη πλευρά"
      },
      "tips": [
        "Αν βάλεις μυζήθρα χτυπημένη μαζί με τα αυγά, ρίχνεις μαζί — δίνει πιο ομοιόμορφο αποτέλεσμα"
      ],
      "ingredients_used": ["αυγά (ολόκληρα)", "ασπράδι αυγού", "αλάτι", "πιπέρι"]
    },
    {
      "order": 5,
      "title": "Γύρισμα / δίπλωμα",
      "instruction": "Γυρνάς ή διπλώνεις την ομελέτα και ψήνεις ακόμα 2 λεπτά την άλλη πλευρά.",
      "heat_setting": {
        "level": "4-5",
        "label": "μέτρια-χαμηλή"
      },
      "duration": {
        "minutes": 2,
        "until": "να ψηθεί και η δεύτερη πλευρά"
      },
      "tips": [
        "Αν βάλεις μυζήθρα θρυμματισμένη πάνω, ρίχνεις πριν διπλώσεις — πιο rustic αποτέλεσμα"
      ],
      "ingredients_used": []
    }
  ],
  "general_tips": [
    "Αναλογία αυγών: 2 ολόκληρα + 1 ασπράδι για ελαφρύτερο αποτέλεσμα",
    "Μυζήθρα — δύο τρόποι: χτυπημένη μαζί με τα αυγά (πιο ομοιόμορφη) ή θρυμματισμένη πάνω στο τέλος (πιο rustic)",
    "🚫 ΟΧΙ χυμό ντομάτας μέσα στην ομελέτα. Η γεύση βγαίνει καλή ΑΛΛΑ η ομελέτα γίνεται υγρή, δεν είναι συμπαγής, σπάει. Δοκιμάστηκε, επιβεβαιώθηκε. Αν θες ντομάτα, φρέσκια ντομάτα δίπλα στο πιάτο"
  ],
  "modifications_log": [],
  "rating": {},
  "created_at": "2026-02-11T00:00:00.000Z",
  "updated_at": "2026-02-11T00:00:00.000Z"
}
