{
  "id": "makaronia-me-kima",
  "name": "Μακαρόνια με Κιμά",
  "name_en": "Spaghetti with Meat Sauce",
  "description": "Κλασική ελληνική σάλτσα κιμά με αργό σιγοβράσιμο για πλούσια γεύση, σερβιρισμένη με μακαρόνια.",
  "category": "ζυμαρικά",
  "tags": ["κιμάς", "μακαρόνια", "σάλτσα", "κλασικό"],
  "source": {
    "origin": "original"
  },
  "servings": {
    "amount": 3,
    "label": "μερίδες"
  },
  "time": {
    "prep_minutes": 10,
    "cook_minutes": 45,
    "total_minutes": 55
  },
  "difficulty": "εύκολο",
  "equipment": [
    "πλατιά κατσαρόλα ή βαθύ τηγάνι",
    "κατσαρόλα για μακαρόνια"
  ],
  "ingredients": [
    {
      "group": "Βάση",
      "name": "κιμάς",
      "amount": 500,
      "unit": "γρ",
      "notes": "μοσχάρι/χοίρος mix",
      "optional": false,
      "substitutions": []
    },
    {
      "group": "Βάση",
      "name": "μακαρόνια",
      "optional": false,
      "substitutions": []
    },
    {
      "group": "Αρωματικά",
      "name": "κρεμμύδι",
      "amount": 1,
      "unit": "τεμ",
      "notes": "ψιλοκομμένο",
      "optional": false,
      "substitutions": []
    },
    {
      "group": "Αρωματικά",
      "name": "σκόρδο",
      "amount": 2,
      "unit": "σκελίδες",
      "optional": false,
      "substitutions": []
    },
    {
      "group": "Αρωματικά",
      "name": "φύλλα δάφνη",
      "amount": 2,
      "unit": "τεμ",
      "optional": false,
      "substitutions": []
    },
    {
      "group": "Σάλτσα",
      "name": "passata",
      "amount": 225,
      "unit": "γρ",
      "notes": "ή 1 κ.σ. πελτέ αραιωμένο σε νερό",
      "optional": false,
      "substitutions": ["πελτές αραιωμένος σε νερό"]
    },
    {
      "group": "Σάλτσα",
      "name": "νερό",
      "amount": 240,
      "unit": "ml",
      "optional": false,
      "substitutions": []
    },
    {
      "group": "Καρυκεύματα",
      "name": "αλάτι",
      "optional": false,
      "substitutions": []
    },
    {
      "group": "Καρυκεύματα",
      "name": "πιπέρι",
      "optional": false,
      "substitutions": []
    },
    {
      "group": "Προαιρετικά",
      "name": "πιπεριά",
      "amount": 1,
      "unit": "τεμ",
      "optional": true,
      "substitutions": []
    }
  ],
  "steps": [
    {
      "order": 1,
      "title": "Σοτάρισμα κρεμμυδιού",
      "instruction": "Ρίχνεις το ψιλοκομμένο κρεμμύδι στο τηγάνι και σοτάρεις 5-7 λεπτά μέχρι να μαλακώσει.",
      "heat_setting": {
        "level": "5-6",
        "label": "μέτρια"
      },
      "duration": {
        "minutes": 6,
        "until": "να μαλακώσει"
      },
      "tips": [],
      "ingredients_used": ["κρεμμύδι"]
    },
    {
      "order": 2,
      "title": "Σκόρδο",
      "instruction": "Προσθέτεις το σκόρδο στην ίδια φωτιά και ανακατεύεις για 30 δευτερόλεπτα μόνο.",
      "heat_setting": {
        "level": "5-6",
        "label": "μέτρια"
      },
      "duration": {
        "minutes": 0.5,
        "until": "να αρωματίσει"
      },
      "tips": ["Μόνο 30 δευτερόλεπτα — το σκόρδο καίγεται εύκολα"],
      "ingredients_used": ["σκόρδο"]
    },
    {
      "order": 3,
      "title": "Ψήσιμο κιμά",
      "instruction": "Ανεβάζεις τη φωτιά και ρίχνεις τον κιμά. Τον σπας καλά και τον ψήνεις 5-7 λεπτά μέχρι να πάρει καφέ χρώμα.",
      "heat_setting": {
        "level": "6-7",
        "label": "μέτρια-δυνατή"
      },
      "duration": {
        "minutes": 6,
        "until": "να πάρει καφέ χρώμα"
      },
      "tips": ["Σπάσε τον κιμά καλά με κουτάλα για ομοιόμορφο ψήσιμο"],
      "ingredients_used": ["κιμάς"]
    },
    {
      "order": 4,
      "title": "Ντομάτα και βρασμός",
      "instruction": "Προσθέτεις passata (ή πελτέ αραιωμένο σε νερό), νερό και φύλλα δάφνη. Ανεβάζεις τη φωτιά μέχρι να πιάσει βράσιμο.",
      "heat_setting": {
        "level": "7-8",
        "label": "δυνατή"
      },
      "duration": {
        "until": "να πιάσει βράσιμο"
      },
      "tips": ["Αν βάλεις passata (200-250γρ), ρίχνεις λιγότερο νερό. Αν βάλεις πελτέ, θέλει αραίωση σε νερό."],
      "ingredients_used": ["passata", "νερό", "φύλλα δάφνη"]
    },
    {
      "order": 5,
      "title": "Σιγοβράσιμο σάλτσας",
      "instruction": "Κατεβάζεις τη φωτιά και αφήνεις να σιγοβράσει ΧΩΡΙΣ καπάκι για 20-50 λεπτά. Όσο περισσότερο σιγοβράζει, τόσο καλύτερη η γεύση — η σάλτσα πρέπει να δέσει.",
      "heat_setting": {
        "level": "4-5",
        "label": "μέτρια-χαμηλή"
      },
      "duration": {
        "minutes": 35,
        "until": "η σάλτσα να δέσει και να πυκνώσει"
      },
      "tips": [
        "Ιδανικά 40-50 λεπτά για την καλύτερη γεύση",
        "Χωρίς καπάκι για να φύγει η υγρασία και να πυκνώσει"
      ],
      "ingredients_used": []
    },
    {
      "order": 6,
      "title": "Βράσιμο μακαρονιών",
      "instruction": "Βράζεις τα μακαρόνια ξεχωριστά σε αλατισμένο νερό σε δυνατή φωτιά (μάτι στο 9), σύμφωνα με τις οδηγίες της συσκευασίας.",
      "heat_setting": {
        "level": "9",
        "label": "MAX"
      },
      "duration": {
        "until": "σύμφωνα με τη συσκευασία"
      },
      "tips": [],
      "ingredients_used": ["μακαρόνια"]
    }
  ],
  "serving_suggestion": "Σερβίρεται με τριμμένη κεφαλογραβιέρα ή παρμεζάνα",
  "general_tips": [
    "Όσο πιο πολύ σιγοβράζει (40-50 λεπτά), τόσο καλύτερη γεύση — η σάλτσα πρέπει να δέσει",
    "Passata ≠ πελτές: αν βάλεις πελτέ, θέλει αραίωση σε νερό. Αν βάλεις passata (200-250γρ), ρίχνεις λιγότερο νερό",
    "Χωρίς καπάκι στο σιγοβράσιμο για να φύγει η υγρασία και να πυκνώσει"
  ],
  "modifications_log": [],
  "rating": {},
  "created_at": "2026-02-11T00:00:00.000Z",
  "updated_at": "2026-02-11T00:00:00.000Z"
}
